{
  "schemaVersion": "1.0.0",
  "id": "centerstage_2023_field",
  "displayName": "CENTERSTAGE 2023–2024 field (AUTO, schematic)",
  "season": {
    "slug": "centerstage",
    "officialName": "CENTERSTAGE presented by RTX",
    "competitionYear": "2023-2024"
  },
  "provenance": {
    "manualRevision": "archive-2024",
    "sourceUrl": "https://ftc-resources.firstinspires.org/ftc/archive/2024/game-one-page",
    "effectiveDate": "2024-04-01",
    "geometryProvenance": "hand_authored",
    "verifyAgainstManual": true,
    "notes": "Schematic AUTO: three spike marks, backdrop columns, backstage park. Point values from the archived one-pager. VERIFY artwork/CAD before freeze."
  },
  "coordinateSystem": {
    "convention": "ftc_official_red_wall",
    "units": "inch",
    "origin": "field_center_tile_surface",
    "xIncreases": "right_when_facing_from_red_wall",
    "yIncreases": "away_from_red_wall",
    "headingPositive": "ccw"
  },
  "fieldSizeIn": { "width": 144, "depth": 144, "wallHeight": 12, "tileSize": 24 },
  "requiredCapabilities": [
    "planar_drive",
    "static_colliders",
    "dynamic_game_pieces",
    "trigger_volumes",
    "occluders",
    "apriltag_vision",
    "randomized_match_variable",
    "partial_observability_sentinel",
    "n_stage_scoring",
    "end_of_phase_scoring",
    "phase_clock"
  ],
  "elements": [
    {
      "id": "perimeter",
      "type": "wall",
      "alliance": "neutral",
      "pose": { "x": 0, "y": 0, "headingDeg": 0 },
      "shape": { "kind": "aabb", "width": 144, "depth": 144 },
      "isCollider": true,
      "tags": ["perimeter"]
    },
    {
      "id": "restricted_for_red",
      "type": "zone",
      "alliance": "blue",
      "pose": { "x": 36, "y": 0, "headingDeg": 0 },
      "shape": { "kind": "aabb", "width": 72, "depth": 144 },
      "isCollider": false,
      "isOccluder": false,
      "isTrigger": true,
      "triggerId": "restricted_for_red",
      "tags": ["restricted_for_red"]
    },
    {
      "id": "restricted_for_blue",
      "type": "zone",
      "alliance": "red",
      "pose": { "x": -36, "y": 0, "headingDeg": 0 },
      "shape": { "kind": "aabb", "width": 72, "depth": 144 },
      "isCollider": false,
      "isOccluder": false,
      "isTrigger": true,
      "triggerId": "restricted_for_blue",
      "tags": ["restricted_for_blue"]
    },
    {
      "id": "red_backdrop",
      "type": "backdrop",
      "alliance": "red",
      "pose": { "x": 36, "y": 66, "headingDeg": 0 },
      "shape": { "kind": "aabb", "width": 48, "depth": 4 },
      "isCollider": true,
      "isOccluder": true,
      "isTrigger": true,
      "triggerId": "red_backdrop",
      "tags": ["backdrop"]
    },
    {
      "id": "red_backdrop_left",
      "type": "backdrop_column",
      "alliance": "red",
      "pose": { "x": 20, "y": 62, "headingDeg": 0 },
      "shape": { "kind": "aabb", "width": 12, "depth": 6 },
      "isCollider": false,
      "isTrigger": true,
      "triggerId": "red_backdrop_left",
      "tags": ["backdrop", "column", "left"]
    },
    {
      "id": "red_backdrop_center",
      "type": "backdrop_column",
      "alliance": "red",
      "pose": { "x": 36, "y": 62, "headingDeg": 0 },
      "shape": { "kind": "aabb", "width": 12, "depth": 6 },
      "isCollider": false,
      "isTrigger": true,
      "triggerId": "red_backdrop_center",
      "tags": ["backdrop", "column", "center"]
    },
    {
      "id": "red_backdrop_right",
      "type": "backdrop_column",
      "alliance": "red",
      "pose": { "x": 52, "y": 62, "headingDeg": 0 },
      "shape": { "kind": "aabb", "width": 12, "depth": 6 },
      "isCollider": false,
      "isTrigger": true,
      "triggerId": "red_backdrop_right",
      "tags": ["backdrop", "column", "right"]
    },
    {
      "id": "red_backstage",
      "type": "backstage",
      "alliance": "red",
      "pose": { "x": 36, "y": 54, "headingDeg": 0 },
      "shape": { "kind": "aabb", "width": 48, "depth": 16 },
      "isCollider": false,
      "isTrigger": true,
      "triggerId": "red_backstage",
      "tags": ["backstage", "park"]
    },
    {
      "id": "red_spike_left",
      "type": "spike_mark",
      "alliance": "red",
      "pose": { "x": -24, "y": -36, "headingDeg": 0 },
      "shape": { "kind": "circle", "radius": 6 },
      "isCollider": false,
      "isTrigger": true,
      "triggerId": "red_spike_left",
      "tags": ["spike", "left"]
    },
    {
      "id": "red_spike_center",
      "type": "spike_mark",
      "alliance": "red",
      "pose": { "x": 0, "y": -36, "headingDeg": 0 },
      "shape": { "kind": "circle", "radius": 6 },
      "isCollider": false,
      "isTrigger": true,
      "triggerId": "red_spike_center",
      "tags": ["spike", "center"]
    },
    {
      "id": "red_spike_right",
      "type": "spike_mark",
      "alliance": "red",
      "pose": { "x": 24, "y": -36, "headingDeg": 0 },
      "shape": { "kind": "circle", "radius": 6 },
      "isCollider": false,
      "isTrigger": true,
      "triggerId": "red_spike_right",
      "tags": ["spike", "right"]
    }
  ],
  "gamePieces": [
    {
      "typeId": "token_white",
      "displayName": "White randomization token",
      "shape": { "kind": "aabb", "width": 3, "depth": 3 },
      "massKg": 0.02,
      "attributes": { "role": "randomization", "color": "W" }
    },
    {
      "typeId": "token_purple",
      "displayName": "Purple scoring token",
      "shape": { "kind": "aabb", "width": 3, "depth": 3 },
      "massKg": 0.02,
      "color": "purple",
      "attributes": { "color": "P" }
    },
    {
      "typeId": "token_yellow",
      "displayName": "Yellow scoring token",
      "shape": { "kind": "aabb", "width": 3, "depth": 3 },
      "massKg": 0.02,
      "color": "yellow",
      "attributes": { "color": "Y" }
    }
  ],
  "spawns": [
    {
      "id": "purple_preload",
      "pieceTypeId": "token_purple",
      "preloadEligible": true,
      "poses": [{ "x": -32, "y": -52, "headingDeg": 0 }]
    },
    {
      "id": "yellow_preload",
      "pieceTypeId": "token_yellow",
      "preloadEligible": true,
      "poses": [{ "x": -28, "y": -52, "headingDeg": 0 }]
    }
  ],
  "startSlots": [
    {
      "id": "red_0",
      "alliance": "red",
      "slot": 0,
      "pose": { "x": -36, "y": -60, "headingDeg": 90 }
    },
    {
      "id": "red_1",
      "alliance": "red",
      "slot": 1,
      "pose": { "x": 12, "y": -60, "headingDeg": 90 }
    },
    {
      "id": "blue_0",
      "alliance": "blue",
      "slot": 0,
      "pose": { "x": 36, "y": 60, "headingDeg": -90 }
    },
    {
      "id": "blue_1",
      "alliance": "blue",
      "slot": 1,
      "pose": { "x": -12, "y": 60, "headingDeg": -90 }
    }
  ],
  "aprilTags": [
    {
      "family": "36h11",
      "tagId": 21,
      "pose": { "x": -24, "y": -36, "headingDeg": -90, "z": 1 },
      "sizeIn": 2,
      "role": "randomization",
      "mapsTo": "left"
    },
    {
      "family": "36h11",
      "tagId": 22,
      "pose": { "x": 0, "y": -36, "headingDeg": -90, "z": 1 },
      "sizeIn": 2,
      "role": "randomization",
      "mapsTo": "center"
    },
    {
      "family": "36h11",
      "tagId": 23,
      "pose": { "x": 24, "y": -36, "headingDeg": -90, "z": 1 },
      "sizeIn": 2,
      "role": "randomization",
      "mapsTo": "right"
    },
    {
      "family": "36h11",
      "tagId": 4,
      "pose": { "x": 36, "y": 66, "headingDeg": 180, "z": 8 },
      "sizeIn": 2,
      "onElementId": "red_backdrop",
      "role": "localization"
    }
  ]
}
